{
  "id": "form-035",
  "version": 1,
  "legacy_line": 35,
  "name": "Undated contradiction",
  "name_fr": "Contradiction sans date",
  "origin": {
    "organisation": "Loxyn SAS, Lyon",
    "campaign": "August 2026 — observation campaign (Korela For Science)",
    "contact": "contact@loxyn.ai"
  },
  "damage": "WRONG_VALUE",
  "class": "IRREDUCIBLE",
  "layer": "⑧ coherence",
  "injection": "ALTER",
  "legacy_severity": "G2",
  "legacy_mechanism": "M5",
  "status": "migrated_unreviewed",
  "seen": [
    {
      "corpus": "observation 2026-08 (272 Europe PMC JATS articles)",
      "date": "2026-08-08",
      "observer": "house observer (LLM agent), see report",
      "excerpt": "MESURÉ le 08/08/2026 sur les 272 articles de (internal corpus of 272 JATS articles) : 15 049 des 16 411 paragraphes de corps (92 %) ne contiennent AUCUNE année. L'affirmation non datée est donc la norme, pas l'exception — et deux affirmations non datées ne peuvent pas être départagées par la date. (Sonde : comptage des <p> du <body> portant un jeton d'année 19xx/20xx.)",
      "lang": "fr",
      "excerpt_en": "MEASURED on 2026-08-08 on the 272 articles of the internal corpus: 15,049 of the 16,411 body paragraphs (92 %) contain NO year. The undated statement is therefore the norm, not the exception — and two undated statements cannot be separated by date. (Probe: count of <p> in <body> carrying a 19xx/20xx year token.)",
      "organisation": "Loxyn SAS, Lyon",
      "corpus_id": "corpus-europe-pmc-jats-2023-2026"
    }
  ],
  "specimens": {
    "cases": [],
    "counter_examples": []
  },
  "prevention": {
    "cancellable_by_code": false
  },
  "repair": {
    "reachable_by_deletion": "no",
    "note": "deletion cannot restore this; judgment of 2026-09-09, to be measured"
  },
  "judgeable_by": [
    "construction",
    "registry",
    "dated_future",
    "closed_world"
  ],
  "history": [
    {
      "date": "2026-08-09",
      "event": "catalogue line 35 — GOLDEN (kept for the benchmark): irreducible or silent false",
      "by": "Korela For Science"
    },
    {
      "date": "2026-09-09",
      "event": "migrated; classified damage=WRONG_VALUE injection=ALTER (judgment, unreviewed by a second reader)",
      "by": "Fault Atlas migration"
    },
    {
      "date": "2026-09-09",
      "event": "internal tool paths removed from observation notes before publication; wording otherwise unchanged",
      "by": "Fault Atlas"
    }
  ]
}
