{
  "id": "form-131",
  "version": 3,
  "legacy_line": 131,
  "name": "Display mathematics inside the abstract",
  "name_fr": "Le résumé contient des mathématiques en display",
  "origin": {
    "organisation": "Loxyn SAS, Lyon",
    "campaign": "August 2026 — observation campaign (Korela For Science)",
    "contact": "contact@loxyn.ai"
  },
  "damage": "MISSING",
  "class": "DEFEATED_IF_XML",
  "layer": "③ utterance",
  "injection": "FORMAT",
  "legacy_severity": "G3",
  "legacy_mechanism": "M8",
  "status": "validated",
  "seen": [
    {
      "corpus": "14 articles 2021-2026 outside biomedicine (arXiv, PLOS, Copernicus, HAL, Scientific Reports), 'rare genres' wave",
      "document": "document identifiers not kept by the observer (lesson of 2026-08-08: 81 documents observed, no specimen archived)",
      "date": "2026-08-08",
      "observer": "house observer (LLM agent), 'rare genres' wave of August 2026",
      "excerpt": "Observé le 08/08 sur 14 articles de 2021-2026 hors biomédecine : le résumé s'interrompt sur une inégalité pleine largeur ; le résumé cesse d'être du texte. Jamais observé en biomédical. Mesuré ensuite sur les 272 JATS : 6 articles ont une formule EN LIGNE dans le résumé, tous en physique — ce n'est pas la même ligne.",
      "excerpt_en": "Observed on 2026-08-08 on 14 articles 2021-2026 outside biomedicine: the abstract breaks off on a full-width inequality; the abstract stops being text. Never observed in biomedicine. Then measured on the 272 JATS: 6 articles have an INLINE formula in the abstract, all in physics — not the same line.",
      "lang": "fr",
      "organisation": "Loxyn SAS, Lyon",
      "reserve": "Reserve (second reader, 2026-09-10): the identifiers of the 14 articles of 2021-2026 outside biomedicine (arXiv, PLOS, Copernicus, HAL, Scientific Reports) were not kept in August; the observation is cited, not reproducible, until those articles are found again."
    }
  ],
  "specimens": {
    "cases": [],
    "counter_examples": []
  },
  "prevention": {
    "cancellable_by_code": true,
    "note": "cancelled only when the source is structured (XML/HTML); not on composed PDF"
  },
  "repair": {
    "reachable_by_deletion": "no",
    "note": "deletion cannot restore this; derived from the damage class by the migration of 2026-09-09, not judged form by form and not measured — the bench can measure it"
  },
  "judgeable_by": [
    "construction",
    "curated",
    "closed_world"
  ],
  "history": [
    {
      "date": "2026-08-09",
      "event": "catalogue line 131 — ACCEPTED (measured absent from the modern XML corpus): measured ABSENT from the modern XML corpus",
      "by": "Korela For Science"
    },
    {
      "date": "2026-09-09",
      "event": "migrated; classified damage=MISSING injection=FORMAT (judgment, unreviewed by a second reader)",
      "by": "Fault Atlas migration"
    },
    {
      "date": "2026-09-09",
      "event": "observation transcribed from the August annex and the wave-1 journal, after the second reader noted the record had no excerpt",
      "by": "Fault Atlas"
    },
    {
      "date": "2026-09-09",
      "event": "exact probe attached, measured absent on the 272 files: probes/2026-08/line-131.py, 0/272",
      "by": "Fault Atlas maintainer"
    },
    {
      "date": "2026-09-10",
      "event": "reserve put on the observation itself: identifiers of the 14 non-biomedical articles not kept, observation cited, not reproducible",
      "by": "Fault Atlas maintainer, at the second reader's request"
    },
    {
      "date": "2026-09-10",
      "event": "second reader: validated — read in full with the record: a dated measurement, a named corpus, real forms",
      "by": "Coralie Bagnol-Lebon"
    }
  ],
  "observed_absent_in": [
    "Europe PMC JATS 2023-2026 (272 articles): 0/272 by the exact probe probes/2026-08/line-131.py, written 2026-08-08, re-run 2026-09-09"
  ],
  "probes": [
    {
      "file": "probes/2026-08/line-131.py",
      "kind": "python",
      "corpus_id": "corpus-europe-pmc-jats-2023-2026",
      "written": "2026-08-08",
      "run": "python3 tools/run_probe.py probes/2026-08/line-131.py <dir with the 272 .xml>",
      "result": {
        "date": "2026-09-09",
        "count": 0,
        "of": 272,
        "strata": {},
        "examples": [],
        "by": "Fault Atlas maintainer (Loxyn), re-run on the same 272 files",
        "carriers_file": "probes/results/line-131.json"
      },
      "matches_excerpt": true,
      "note": "Measured absent: the probe finds no carrier among the 272 files. An absence is a result, dated."
    }
  ],
  "observer_agreement": "2/2 — first reader (Loxyn, August/September classification) and second reader (Coralie Bagnol-Lebon, 2026-09-10)",
  "failure_mode": {
    "value": "MANQ",
    "means": "a gap: the graph is incomplete where the reading did not reach, not wrong",
    "source": "the internal catalogue of 2026-08-09 (korela.db, table parametre), line 131; it is not derived from the damage and varies inside a damage class"
  }
}
