{
  "id": "form-062",
  "version": 2,
  "legacy_line": 62,
  "name": "Document reduced to its title",
  "name_fr": "Document réduit à son titre",
  "origin": {
    "organisation": "Loxyn SAS, Lyon",
    "campaign": "August 2026 — observation campaign (Korela For Science)",
    "contact": "contact@loxyn.ai"
  },
  "damage": "MISSING",
  "class": "IRREDUCIBLE",
  "layer": "② reading",
  "injection": "DELETE",
  "legacy_severity": "G3",
  "legacy_mechanism": "M11",
  "status": "validated",
  "seen": [
    {
      "corpus": "observation 2026-08 (272 Europe PMC JATS articles)",
      "date": "2026-08-08",
      "observer": "house observer (LLM agent), see report",
      "excerpt": "COMPTÉ le 08/08/2026 sur un corpus PubMed réel (annexe 62) : 731 articles sur 3 642 — 20 % du corpus arginine — n'ont aucun corps de texte ; 321 sur 866 — 37 % — sur un second corpus du même dossier. Conséquence mesurée le 31/07 : le juge exige une phrase-preuve, qui sur ces documents ne peut exister.",
      "lang": "fr",
      "excerpt_en": "COUNTED on 2026-08-08 on a real PubMed corpus (annex 62): 731 articles out of 3,642 — 20 % of the arginine corpus — have no body text at all; 321 out of 866 — 37 % — on a second corpus of the same folder. Consequence measured on 2026-07-31: the judge requires an evidence sentence, which on these documents cannot exist.",
      "organisation": "Loxyn SAS, Lyon"
    }
  ],
  "specimens": {
    "cases": [],
    "counter_examples": []
  },
  "prevention": {
    "cancellable_by_code": false
  },
  "repair": {
    "reachable_by_deletion": "no",
    "note": "deletion cannot restore this; derived from the damage class by the migration of 2026-09-09, not judged form by form and not measured — the bench can measure it"
  },
  "judgeable_by": [
    "construction",
    "curated",
    "closed_world"
  ],
  "history": [
    {
      "date": "2026-08-09",
      "event": "catalogue line 62 — GOLDEN (kept for the benchmark): irreducible or silent false",
      "by": "Korela For Science"
    },
    {
      "date": "2026-09-09",
      "event": "migrated; classified damage=MISSING injection=DELETE (judgment, unreviewed by a second reader)",
      "by": "Fault Atlas migration"
    },
    {
      "date": "2026-09-10",
      "event": "second reader: validated — read in full with the record: a dated measurement, a named corpus, real forms",
      "by": "Coralie Bagnol-Lebon"
    }
  ],
  "observer_agreement": "2/2 — first reader (Loxyn, August/September classification) and second reader (Coralie Bagnol-Lebon, 2026-09-10)",
  "failure_mode": {
    "value": "MANQ",
    "means": "a gap: the graph is incomplete where the reading did not reach, not wrong",
    "source": "the internal catalogue of 2026-08-09 (korela.db, table parametre), line 62; it is not derived from the damage and varies inside a damage class"
  }
}
