{
  "id": "form-022",
  "version": 2,
  "legacy_line": 22,
  "name": "Pronominal references",
  "name_fr": "Reprises pronominales",
  "origin": {
    "organisation": "Loxyn SAS, Lyon",
    "campaign": "August 2026 — observation campaign (Korela For Science)",
    "contact": "contact@loxyn.ai"
  },
  "damage": "MERGE",
  "class": "IRREDUCIBLE",
  "layer": "③ utterance",
  "injection": "RENAME",
  "legacy_severity": "G1",
  "legacy_mechanism": "M2",
  "status": "validated",
  "seen": [
    {
      "corpus": "observation 2026-08 (272 Europe PMC JATS articles)",
      "date": "2026-08-08",
      "observer": "house observer (LLM agent), see report",
      "excerpt": "MESURÉ le 08/08/2026 sur les 272 articles XML JATS de l'atelier : 212/272 (78 %) ouvrent au moins une phrase par une reprise nue (It/They/These/This), 3 260 occurrences au total ; 49/272 (18 %) portent une reprise lexicale explicite — relevé « In the latter study, the risk of developing T2DM was significantly lower » (bio-PMC12915353).",
      "lang": "fr",
      "excerpt_en": "MEASURED on 2026-08-08 on the 272 JATS XML articles of the workshop: 212/272 (78 %) open at least one sentence with a bare anaphor (It/They/These/This), 3,260 occurrences in total; 49/272 (18 %) carry an explicit lexical anaphor — recorded: \"In the latter study, the risk of developing T2DM was significantly lower\" (bio-PMC12915353).",
      "organisation": "Loxyn SAS, Lyon",
      "corpus_id": "corpus-europe-pmc-jats-2023-2026",
      "probe": "probes/2026-08/line-022.py"
    }
  ],
  "specimens": {
    "cases": [],
    "counter_examples": []
  },
  "prevention": {
    "cancellable_by_code": false
  },
  "repair": {
    "reachable_by_deletion": "no",
    "note": "deletion cannot restore this; derived from the damage class by the migration of 2026-09-09, not judged form by form and not measured — the bench can measure it",
    "measured": {
      "value": "no",
      "reached": 0,
      "injected": 2532,
      "note": "0 of 2,532 reached",
      "source": "measured 2026-09-10 by pgrepair (SciPyWeightedILP) on the frozen EUR-Lex truth, three identical runs, journal sha256 in measures/reachability-by-damage-2026-09-10.json. Per damage class, not per form: two forms of the same damage and the same visibility get the same answer.",
      "date": "2026-09-10"
    }
  },
  "judgeable_by": [
    "construction",
    "registry",
    "curated",
    "closed_world"
  ],
  "history": [
    {
      "date": "2026-08-09",
      "event": "catalogue line 22 — GOLDEN (kept for the benchmark): irreducible or silent false",
      "by": "Korela For Science"
    },
    {
      "date": "2026-09-09",
      "event": "migrated; classified damage=MERGE injection=RENAME (judgment, unreviewed by a second reader)",
      "by": "Fault Atlas migration"
    },
    {
      "date": "2026-09-09",
      "event": "exact probe attached to the 272-file observation: probes/2026-08/line-022.py (rewritten from the campaign's inline script), re-run 212/272",
      "by": "Fault Atlas maintainer"
    },
    {
      "date": "2026-09-10",
      "event": "second reader: validated — read in full with the record: a dated measurement, a named corpus, real forms",
      "by": "Coralie Bagnol-Lebon"
    }
  ],
  "probes": [
    {
      "file": "probes/2026-08/line-022.py",
      "kind": "python",
      "corpus_id": "corpus-europe-pmc-jats-2023-2026",
      "written": "2026-08-08",
      "run": "python3 tools/run_probe.py probes/2026-08/line-022.py <dir with the 272 .xml>",
      "result": {
        "date": "2026-09-09",
        "count": 212,
        "of": 272,
        "strata": {
          "bio": 34,
          "cas": 34,
          "essai": 34,
          "meta": 34,
          "phys": 34,
          "moderne": 17,
          "retract": 16,
          "nonEN": 9
        },
        "examples": [
          [
            "bio-PMC12583535.xml",
            [
              "pronoun-subject x30"
            ]
          ],
          [
            "bio-PMC12590050.xml",
            [
              "pronoun-subject x15"
            ]
          ],
          [
            "bio-PMC12674831.xml",
            [
              "pronoun-subject x66",
              "lexical reprise: this group"
            ]
          ],
          [
            "bio-PMC12857832.xml",
            [
              "pronoun-subject x6",
              "lexical reprise: this group"
            ]
          ],
          [
            "bio-PMC12882215.xml",
            [
              "pronoun-subject x16"
            ]
          ],
          [
            "bio-PMC12909487.xml",
            [
              "pronoun-subject x19",
              "lexical reprise: this group"
            ]
          ],
          [
            "bio-PMC12915353.xml",
            [
              "pronoun-subject x13",
              "lexical reprise: the latter"
            ]
          ],
          [
            "bio-PMC12927065.xml",
            [
              "pronoun-subject x12"
            ]
          ],
          [
            "bio-PMC12927975.xml",
            [
              "pronoun-subject x6"
            ]
          ],
          [
            "bio-PMC12953170.xml",
            [
              "pronoun-subject x6"
            ]
          ],
          [
            "bio-PMC12959687.xml",
            [
              "pronoun-subject x5"
            ]
          ],
          [
            "bio-PMC13057049.xml",
            [
              "pronoun-subject x65"
            ]
          ]
        ],
        "by": "Fault Atlas maintainer (Loxyn), re-run on the same 272 files",
        "carriers_file": "probes/results/line-022.json"
      },
      "matches_excerpt": true
    }
  ],
  "observer_agreement": "2/2 — first reader (Loxyn, August/September classification) and second reader (Coralie Bagnol-Lebon, 2026-09-10)",
  "failure_mode": {
    "value": "PROP",
    "means": "identity: one thing appears under several forms, or several things under one — the error lands on a node and propagates to everything hanging from it",
    "source": "the internal catalogue of 2026-08-09 (korela.db, table parametre), line 22; it is not derived from the damage and varies inside a damage class"
  }
}
